{
  "question": "合成示例：在预算相同的条件下，观察到的指标变化是否来自目标机制？",
  "type": "measurement",
  "known": ["SYNTHETIC EXAMPLE — NOT A REAL SCIENTIFIC CLAIM；本示例没有真实论文或实验结果。"],
  "source_observations": "未提供真实来源；示例问题中的观察也是假设性描述。",
  "gap": "尚不知道指标是否能区分目标机制与替代解释；需要真实来源与数据核验。",
  "alternatives": ["模型能力、任务难度或测量方式可能解释观察到的差异。"],
  "reverse_search": "尚未执行。计划寻找在相同预算和匹配条件下已隔离这些替代解释的测量研究；不能据此声称不存在已有方案。",
  "boundary": "目前仅是待核验的问题边界；实际反向检索与近邻阅读后可能撤回或收窄。",
  "test": "计划比较同预算的匹配设置并加入一个相关控制；尚未执行。",
  "scientific_consequence": "若测试有效且排除替代解释，可以收窄指标所反映的机制；控制失效时只能保留未知。",
  "next_step": "先核验已有测量研究和协议，再确定具体判别条件。",
  "limitations": ["未执行外部检索，未读取真实近邻，未确认资源。"],
  "decision": "HOLD"
}
